Component,Description,Key Features
AI Advanced Monitoring,Monitors system health and performance in real time,"Real-time analysis, anomaly detection, resource tracking"
AI Advanced Reporting,Generates insightful reports from collected data,"Automated report generation, customizable templates, integration with external tools"
AI Alerting,Sends alerts for system anomalies or predefined thresholds,"Threshold-based alerts, supports multiple channels (email, SMS, etc.), customizable alert logic"
AI Anomaly Detection,Identifies unusual patterns in data to flag potential issues,"Pattern analysis, threshold settings, AI-enhanced detection methods"
AI Audit Logger,Logs system and user activities for compliance and tracking,"Immutable logs, real-time logging, secure storage"
AI Automated Data Pipeline,Automates the entire data pipeline for preprocessing and analysis,"Data ingestion, cleaning, transformation, pipeline monitoring"
AI Bias Auditor,Evaluates AI models for potential biases in output,"Fairness checks, data distribution analysis, bias mitigation"
AI Clustering,Clusters data into meaningful groups for analysis,"K-means, DBSCAN, and hierarchical clustering supported"
AI Configuration Loader,Handles loading configurations dynamically for AI systems,"Filesystem-based and cloud-based configuration loaders, updates in real time"